Suburb,Location,Main risk,Supports,Description,Longitude,Latitude
"Forrestdale","13 & 4, Forrestdale","Other",0,"Since the road is at 80 speed, would like to have repeater for both directions  because we are having less time to stop when the signal goes from yellow to red.",115.963088572,-32.1313336279
"Forrestdale","Armadale Rd & Nicholson Rd, Piara Waters","Area requires lights/roundabout",5,"The traffic lights at the intersection of Armadale Road and Nicholson Road have been removed and a roundabout put in which causes chaotic traffic.  Stupidist idea Main Roads have ever come up with.",115.9213829041,-32.1484377736
"Forrestdale","Armadale Rd, Forrestdale","Area requires lights/roundabout",0,"I have see 2 accidents and many near misses here. Turning right onto Armadale road is very dangerous. There is a new primary school here which is set to house over 600+ kids from 2019 (Currently over 300 kids) which will bring extra traffic to the area",115.9122526646,-32.1431531145
"Forrestdale","Armadale Rd & Wright Rd, Piara Waters","Vegetation/objects block visibility",1,"Car accidents, near misses. Very difficult to see cars coming on Armadale Rd when turning out from Taylor. As they are driving at speed it can be very dangerous.",115.9060514569,-32.1403656967
"Forrestdale","Armadale Rd, Piara Waters","Little chance to turn/cross traffic",0,"",115.9062593654,-32.1404503947
