Suburb,Location,Main risk,Supports,Description,Longitude,Latitude
"Wanneroo","84 & Backshall Pl, Wanneroo","Little chance to turn/cross traffic",3,"With the impending upgrade to Wanneroo and Ocean Reef intersection it will mean a constant flow of traffic making it a risk to complete a right hand turn safely",115.7999753952,-31.7783069898
"Wanneroo","Caporn St & Franklin Rd, Mariginiup","Area requires lights/roundabout",2,"Travelling North on Franklin Rd most traffic turns left into Caporn St. The traffic facing Franklin Rd from Caporn St has a Give Way sign and many cars assume they do not need to stop there as the vehicles on Franklin will turn into Caporn.  Some do not. Numerous accidents have happened at this intersection and some of these could be prevented either by way of a Stop sign or, more appropriately given the high volume, a round about.  Also, many poorly patched potholes at that end of Caporn St.",115.8289432526,-31.7337152476
"Wanneroo","257 Franklin Rd, Wanneroo","Poor road surface quality",1,"Poor road surfaces, Poorly light, Poor visibility on turning from Caporn Str, South onto Franklin Rd for the volume of traffic, including large trucks.",115.8290076256,-31.7344452362
"Wanneroo","60-110 Caporn St, Mariginiup","Poor or no provision for cyclists",3,"Risky overtaking at high speed.",115.8122386978,-31.7337034472
"Wanneroo","Elliot Rd & Wanneroo Rd, Wanneroo","Little chance to turn/cross traffic",2,"There are accidents here every other week and it is a very difficult area to get out of. It's just after a speed change sign so it's difficult to judge peoples speeds. A roundabout would be fantastic!",115.8087730408,-31.7626731331
"Wanneroo","Elliot Rd & Wanneroo Rd, Wanneroo","Little chance to turn/cross traffic",0,"2 crashes",115.8087730408,-31.7626184008
"Wanneroo","Franklin Rd & Trichet Rd, Jandabup","Little chance to turn/cross traffic",0,"Franklin Road has a very high traffic volume especially during the morning and afternoon rush hour periods and in conjunction with the current speed limit makes crossing from Trichet Road into Franklin Road (heading north) very dangerous.",115.829372406,-31.7561232761
"Wanneroo","245-275 Scenic Dr, Wanneroo","Lacks overtaking opportunities",0,"Scenic Drive ,Wanneroo has speed limit of 50 klm/hr with roundabouts approx 250 metres apart at 20 klm/hr  and width 3.3 metres per single lane .Bicycle riders cannot meet speed limit -( Bicycle /Pedestrian Path available) which means no overtaking safely as no room due to 1 metre distance requirement .Need road rules changed for bicycle riders to use bicycle paths where available to reduce accidents and not obstruct traffic unduly.",115.7959842682,-31.7541162634
