Local Government Area,Location,Main risk,Supports,Description,Longitude,Latitude
"WYNDHAM-EAST KIMBERLEY","Barringtonia Ave & Weaber Plain Rd, Kununurra","Area requires lights/roundabout",1,"Cars travel higher than the speed limit and few people stop at the stop signs.  The pedestrian crossing is poor so people tend to walk through the intersection and chance it with oncoming and turning vehicles. The road is supposed to be closed to road trains but they still come through. A number of fatalities have happened along Weaber Plain Road over the years and a roundabout would slow traffic improve the intersection and make it safer for pedestrians to cross.",128.7445414066,-15.7745783274
"WYNDHAM-EAST KIMBERLEY","1, Kununurra","Unsafe or poor pedestrian crossing",1,"Main crossing point for the Victoria Highway (National Highway 1) in Kununurra for children walking and cycling to school and other pedestrian traffic.  The crossing point is wide with a poor median strip and the path and road surfaces do not join (there is a small strip that is unsealed) where users could fall, this also makes it difficult for disabled users (wheelchair, goffer) to use the crossing.  ",128.7435168028,-15.7784345939
"WYNDHAM-EAST KIMBERLEY","Old Darwin Rd, Kununurra","Confusing layout",0,"4-way intersection with the main road turning 90 degrees.  The road should be realigned",128.7663638592,-15.8130241395
"WYNDHAM-EAST KIMBERLEY","131-165 Mulligans Lagoon Rd, Kununurra","Poor road surface quality",0,"road turns to mud in the wet",128.7604522705,-15.6675028764
"WYNDHAM-EAST KIMBERLEY","Cockburn Rest Area, Lake Argyle","Area requires lights/roundabout",0,"When vehicles are on the Great Northern Highway and turning right onto the Victoria Highway, they do not look or give way to vehicles travelling on the Great Northern Highway to Wyndham.  Trucks do the same and it is an accident waiting to happen!",128.3720764518,-15.8690408704
